MRS SHIRLEY O'REILLY	MS SHIRLEY O'REILLY	97
THE COMMON SERVICES AGENCY (MORE COMMONLY KNOWN AS NHS NATIONAL SERVICES SCOTLAND) (‘THE AUTHORITY’)	THE COMMON SERVICES AGENCY (MORE COMMONLY KNOWN AS NHS NATIONAL SERVICES SCOTLAND) (’THE AUTHORITY’)	100
THE COMMON SERVICES AGENCY (MORE COMMONLY KNOWN AS NHS NATIONAL SERVICES SCOTLAND) (‘THE AUTHORITY’)	THE COMMON SERVICES AGENCY (MORE COMMONLY KNOWN AS NHS NATIONAL SERVICES SCOTLAND) ("THE AUTHORITY")	100
WEST MIDLANDS FIRE SERVICE.	WEST MIDLANDS FIRE SERVICE	100
NHS SOUTH TYNESIDE CLINICAL COMISSIONING GROUP	NHS, SOUTH TYNESIDE CLINICAL COMMISSIONING GROUP 	99
NHS SOUTH TYNESIDE CLINICAL COMISSIONING GROUP	NHS SOUTH TYNESIDE CLINICAL COMMISSIONING GROUP	99
METROPOLITAN HUOSING TRUST	METROPOLITAN HOUSING TRUST	96
CENTRAL AND NORTH WEST LONDON NHS FOUNDATION TRUST	CENTRAL & NORTH WEST LONDON NHS FOUNDATION TRUST	96
ALL SAINTS' ACADEMY CHELTENHAM	ALL SAINTS ACADEMY CHELTENHAM	100
ADUR DISTRICT COUNCIL & WORTHING BOROUGH COUNCIL	ADUR DISTRICT COUNCIL AND WORTHING BOROUGH COUNCIL	96
NHS DARLINGTON CLINICAL COMMISSIONING GROUP (CCG)	NHS DARLINGTON CLINICAL COMMISSIONING GROUP	96
NHS SOUTH WEST — ACUTES	NHS SOUTH WEST - ACUTES	100
THAMES VALLEY CHARITABLE HOUSING ASSOCIATION	THAMES VALLEY CHARITABLE HOUSING ASSOCIATION (*) 	100
RED KITE COMMUNITY HOUSING	RED KITE COMMUNITY HOUSING 	100
BRADFORD TEACHING HOSPITALS NHS FOUNDATION TRUST	BRADFORD TEACHING HOSPITALS FOUNDATION TRUST	96
ANGLIA RUSKIN UNIVERSITY 	ANGLIA RUSKIN UNIVERSITY	100
HELENA PARTENRSHIPS LTD	HELENA PARTNERSHIPS LTD	96
FORENSIC SERVICES NORTHERN IRELAND	FORENSIC SERVICE NORTHERN IRELAND	99
SOUTH ACTON COMMUNITY BUILDERS CO-OPERATIVE LTD	SOUTH ACTON COMMUNITY BUILDERS CO-OPERATIVE LTD 	100
ENVIRONMENT AGENCY	ENVIRONMENT  AGENCY	100
BIRMINGHAM VOLUNTARY SERVICES COUNCIL	BIRMINGHAM VOLUNTARY SERVICE COUNCIL	99
NHS ENGLAND NORTH (CUMBRIA AND NORTH EAST)	NHS ENGLAND NORTH: CUMBRIA AND NORTH EAST	100
DORSET HEALTHCARE NHS FOUNDATION TRUST	DORSET HEALTCARE NHS FOUNDATION TRUST	99
STOKE-ON-TRENT  CITY COUNCIL	STOKE-ON-TRENT CITY COUNCIL	100
STOKE-ON-TRENT  CITY COUNCIL	STOKE ON TRENT CITY COUNCIL	100
EASTEND HOMES	EAST END HOMES	96
EASTEND HOMES	EASTENDHOMES	96
THE QUEEN ELIZABETH HOSPITAL KING&#039;S LYNN NHS FOUNDATION TRUST	THE QUEEN ELIZABETH HOSPITAL KING'S LYNN NHS FOUNDATION TRUST	97
NORTHUMBERLAND CLINICAL COMMISSIONING GROUP	NHS NORTHUMBERLAND CLINICAL COMMISSIONING GROUP	96
NHS ENGLAND (NORTH) YORKSHIRE AND THE HUMBER	NHS ENGLAND NORTH, YORKSHIRE AND THE HUMBER	100
NHS ENGLAND (NORTH) YORKSHIRE AND THE HUMBER	NHS ENGLAND (NORTH) YORKSHIRE AND THE HUMBER 	100
NHS ENGLAND (NORTH) YORKSHIRE AND THE HUMBER	NHS ENGLAND - NORTH (YORKSHIRE AND THE HUMBER)	100
NHS ENGLAND (NORTH) YORKSHIRE AND THE HUMBER	NHS ENGLAND NORTH (YORKSHIRE AND THE HUMBER)	100
NHS ENGLAND (NORTH) YORKSHIRE AND THE HUMBER	NHS ENGLAND NORTH (YORSHIRE AND THE HUMBER)	99
MIDDLESBROUGH BOROUGH COUNCIL, FINANCE AND INVESTMENT, COMMERCIAL AND CORPORATE SERVICES	MIDDLESBROUGH BOROUGH COUNCIL — FINANCE AND INVESTMENT, COMMERCIAL AND CORPORATE SERVICES	100
BIRMINGHAM WOMEN'S NHS FOUNDATION TRUST	BIRMINGHAM WOMEN&#39;S NHS FOUNDATION TRUST	96
ARDEN GEM CSU	ARDEN & GEM CSU	100
TAUHEEDUL ISLAM BOYS&#39; HIGH SCHOOL	TAUHEEDUL ISLAM BOYS' HIGH SCHOOL	96
CHRISTCHURCH AND EAST DORSET COUNCILS	CHRISTCHURCH AND EAST DORSET COUNCIL	99
AGRI-FOOD AND BIOSCIENCES INSTITUTE (AFBI)	AGRI FOOD AND BIOSCIENCES INSTITUE AFBI	99
SOUTH LONDON AND MAUDSLEY NHS FOUNDATION TRUST	SOUTH LONDON AND THE MAUDSLEY NHS FOUNDATION TRUST	96
CPD — CONSTRUCTION DIVISION	CPD - CONSTRUCTION DIVISION	100
SHEFFIELD TEACHING HOSPITALS NHS FOUNDATION TRUST	SHEFFIELD TEACHING HOSPITAL NHS FOUNDATION TRUST	99
DEPARTMENT FOR COMMUNITIES & LOCAL GOVERNMENT	DEPARTMENT FOR COMMUNITIES AND LOCAL GOVERNMENT	96
LEIDOS SUPPLY LTD. FOR UK MINISTRY OF DEFENCE	LEIDOS SUPPLY LTD FOR UK MINISTRY OF DEFENCE	100
WMCOE – MIDLAND HEART	WMCOE — MIDLAND HEART	100
STRATFORD ON AVON DISTRICT COUNCIL	STRATFORD-ON-AVON DISTRICT COUNCIL	100
EAST LEICESTERSHIRE AND RUTLAND CLINICAL COMMISSIONING GROUP (CCG)	EAST LEICESTERSHIRE AND RUTLAND CLINICAL COMMISSIONING GROUP	97
SOUTHEND ON SEA BOROUGH COUNCIL	SOUTHEND-ON-SEA BOROUGH COUNCIL	100
DEPARTMENT OF BUSINESS, ENERGY AND INDUSTRIAL STRATEGY	DEPARTMENT OF BUSINESS, ENERGY AND INDUSTRIAL STRATEGY.	100
SOUTHERN WATER SERVICES LTD	SOUTHERN WATER SERVICES LTD.	100
MINISTRY OF DEFENCE, C&C,	MINISTRY OF DEFENCE, C&C	100
DERBY CITY COUNCIL (DERBY HOME LTD)	DERBY CITY COUNCIL, (DERBY HOMES LTD)	99
DERBY CITY COUNCIL (DERBY HOME LTD)	DERBY CITY COUNCIL (DERBY HOMES LTD)	99
BIRMINGHAM CHILDREN'S HOSPITAL NHS FOUNDATION TRUST	BIRMINGHAM CHILDREN’S HOSPITAL NHS FOUNDATION TRUST	100
BIRMINGHAM CITY COUNCIL, CORPORATE PROCUREMENT SERVICES	BIRMINGHAM CITY COUNCIL — CORPORATE PROCUREMENT SERVICES	100
CARDIFF AND VALE ULHB	CARDIFF AND VALE  ULHB	100
DUDLEY METROPOLITAN BOROUGH COUNCIL	DUDLEY METROPLITAN BOROUGH COUNCIL	99
WANDSWORTH BOROUGH COUNCIL (ON BEHALF OF THE WANDSWORTH BOROUGH COUNCIL AND THE LONDON BOROUGH OF RICHMOND).	WANDSWORTH BOROUGH COUNCIL (ON BEHALF OF WANDSWORTH BOROUGH COUNCIL AND THE LONDON BOROUGH OF RICHMOND)	98
WANDSWORTH BOROUGH COUNCIL (ON BEHALF OF THE WANDSWORTH BOROUGH COUNCIL AND THE LONDON BOROUGH OF RICHMOND).	WANDSWORTH BOROUGH COUNCIL ((ON BEHALF OF WANDSWORTH BOROUGH COUNCIL AND THE LONDON BOROUGH OF RICHMOND)	98
LEIDOS SUPPLY LTD	LEIDOS SUPPLY, LTD	100
NHS ENGLAND (NORTH) LANCASHIRE	NHS ENGLAND NORTH (LANCASHIRE)	100
THE SECRETARY OF STATE FOR HEALTH (ACTING THROUGH THE DEPARTMENT OF HEALTH) (THE "AUTHORITY") C/O AMBULANCE RADIO PROGRAMME	THE SECRETARY OF STATE FOR HEALTH (ACTING THROUGH THE DEPARTMENT OF HEALTH) (THE “AUTHORITY”) C/O AMBULANCE RADIO PROGRAMME	100
THE SECRETARY OF STATE FOR HEALTH (ACTING THROUGH THE DEPARTMENT OF HEALTH) (THE "AUTHORITY") C/O AMBULANCE RADIO PROGRAMME	THE SECRETARY OF STATE FOR HEALTH (ACTING THROUGH THE DEPARTMENT OF HEALTH) (THE ‘AUTHORITY’) C/O AMBULANCE RADIO PROGRAMME	100
AMGUEDDFA CYMRU — NATIONAL MUSEUM WALES	AMGUEDDFA CYMRU - NATIONAL MUSEUM WALES	100
SHERWOOD FOREST HOSPITALS NHS FOUNDATION TRUST	SHERWOOD FOREST HOSPITALS N H S FOUNDATION TRUST	96
PROCUREMENT AND COMMERCIAL DEPARTEMENT	PROCUREMENT AND COMMERCIAL DEPARTMENT	99
A2DOMINION HOUSING GROUP LTD	A2DOMINION HOUSING GROUP LTD.	100
A2DOMINION HOUSING GROUP LTD	A2 DOMINION HOUSING GROUP LTD.	98
A2DOMINION HOUSING GROUP LTD	A2 DOMINION HOUSING GROUP LTD	98
HULL & EAST YORKSHIRE HOPITALS NHS TRUST	HULL & EAST YORKSHIRE HOSPITALS NHS TRUST	99
TRANSPORT FOR LONDON — RAIL FOR LONDON	TRANSPORT FOR LONDON - RAIL FOR LONDON	100
EASTERN CHESHIRE  CCG	EASTERN CHESHIRE CCG	100
GUY'S AND ST THOMAS NHS FOUNDATION TRUST	GUY'S AND ST THOMAS' NHS FOUNDATION TRUST	100
GUY'S AND ST THOMAS NHS FOUNDATION TRUST	GUY'S AND ST. THOMAS NHS FOUNDATION TRUST	100
GUY'S AND ST THOMAS NHS FOUNDATION TRUST	GUY'S AND ST. THOMAS' NHS FOUNDATION TRUST	100
BIRMINGHAM COMUNITY HEALTHCARE NHS TRUST	BIRMINGHAM COMMUNITY HEALTHCARE NHS TRUST	99
NHS ENGLAND NORTH (CHESHIRE AND MERSEYSIDE)	NHS ENGLAND — NORTH (CHESHIRE AND MERSEYSIDE)	100
NHS ENGLAND NORTH (CHESHIRE AND MERSEYSIDE)	NHS ENGLAND NORTH ( CHESHIRE AND MERSEYSIDE )	100
BOLSOVER DISCTRICT COUNCIL	BOLSOVER DISTRICT COUNCIL	98
ENGLISH HERITAGE- INTERPRETATION 	ENGLISH HERITAGE- INTERPRETATION	100
HEALTHTRUST EUROPE LLP (HTE) ACTING AS AGENT FOR THE UNIVERSITY HOSPITALS OF COVENTRY AND WARWICKSHIRE NHS TRUST (“UHCW”)	HEALTHTRUST EUROPE LLP (HTE) ACTING AS AGENT FOR THE UNIVERSITY HOSPITALS OF COVENTRY AND WARWICKSHIRE NHS TRUST (‘UHCW’)	100
HEALTHTRUST EUROPE LLP (HTE) ACTING AS AGENT FOR THE UNIVERSITY HOSPITALS OF COVENTRY AND WARWICKSHIRE NHS TRUST (“UHCW”)	HEALTHTRUST EUROPE LLP ACTING AS AGENT FOR THE UNIVERSITY HOSPITALS OF COVENTRY AND WARWICKSHIRE NHS TRUST (“UHCW”)	98
WESTMINSTER CITY COUNCIL	WESMINSTER CITY COUNCIL	98
NHS NORTH EAST ESSEX CLINICAL COMMISSIONING GROUP	NORTH EAST ESSEX CLINICAL COMMISSIONING GROUP	96
CENTE FOR PROCESS INNNOVATION LIMITED	CENTRE FOR PROCESS INNOVATION LIMITED	97
CENTE FOR PROCESS INNNOVATION LIMITED	CENTER FOR PROCESS INNOVATION LIMITED	97
NHS HARTLEPOOL AND STOCKTON-ON-TEES AND NHS SOUTH TEES CCG	NHS HARTLEPOOL AND STOCKTON-ON-TEES AND NHS SOUTH TEESH CCG	99
MINISTRY OF DEFENCE, DSTL, DEFENCE SCIENCE & TECHNOLOGY LABORATORY (DSTL)	MINISTRY OF DEFENCE, DSTL, DEFENCE SCIENCE AND TECHNOLOGY LABORATORY (DSTL)	97
MEDICINES AND HEALTHCARE PRODUCTS REGULATORY AGENCY	MEDICINES & HEALTHCARE PRODUCTS REGULATORY AGENCY	96
FORWARD SWINDON LTD	FORWARD SWINDON LTD.	100
DEFENCE SCIENCE & TECHNOLOGY LABORATORY (DSTL)	DSTL, DEFENCE SCIENCE & TECHNOLOGY LABORATORY	100
NHS WALES SHARED SERVICE PARTNERSHIP ON BEHALF OF VELINDRE NHS TRUST	NHS WALES SHARED SERVICES PARTNERSHIP ON BEHALF OF VELINDRE NHS TRUST	99
MR VINCE PROBERT 	MR VINCE PROBERT	100
THE HOME OFFICE.	THE HOME OFFICE	100
BRENT HOUSING PARTNERSIP	BRENT HOUSING PARTNERSHIP	98
NHS ENGLAND, (NORTH) YORKSHIRE, AND HUMBER 	NHS ENGLAND — NORTH (YORKSHIRE AND HUMBER)	100
NHS ENGLAND, (NORTH) YORKSHIRE, AND HUMBER 	NHS ENGLAND - NORTH (YORKSHIRE AND HUMBER)	100
NHS ENGLAND, (NORTH) YORKSHIRE, AND HUMBER 	NHS ENGLAND NORTH (YORKSHIRE AND HUMBER)	100
ST HELENS COUNCIL	ST.HELENS COUNCIL	100
MINISTRY OF DEFENCE (MOD), LAND EQUIPMENT, OPERATIONAL SUPPORT PROGRAMMES (OSP)	MINISTRY OF DEFENCE, LAND EQUIPMENT, OPERATIONAL SUPPORT PROGRAMMES (OSP)	97
PARAGON COMMUNITY HOUSING LIMITED	PARAGON COMMUNITY HOUSING LIMTED	98
NORTH OF ENGLAND COMMISSIONING SUPPORT UNIT	NHS NORTH OF ENGLAND COMMISSIONING SUPPORT UNIT	96
PROPERTIES DIVISION, ENTERPRISE SHARED SERVICES, DEPARTMENT OF FINANCE, NORTHERN IRELAND	PROPERTIES DIVISION, ENTERPRISE SHARED SERVICES, DEPARTMENT OF FINANCE, NORTHERN IRELAND.	100
SHEFFIELD CHILDRENS NHS FOUNDATION TRUST	SHEFFIELD CHILDREN'S NHS FOUNDATION TRUST	96
ENGLISH HERITAGE-ESTATES	ENGLISH HERITAGE-ESTATES 	100
CHELTENHAM BOROUGH COUNCIL	CHELTENHAM BOROUGH COUNCIL        	100
NATIONAL OFFENDER MANAGEMENT SERVICE (NOMS) - PART OF THE MINISTRY OF JUSTICE	NATIONAL OFFENDER MANAGEMENT SERVICE (NOMS) PART OF THE MINISTRY OF JUSTICE	100
ROCHFORD DISTRICT COUNCIL	ROCHFORD DISTRICTG COUNCIL	98
LYCÉE FRANÇAIS CHARLES DE GAULLE	LYCEE FRANCAIS CHARLES DE GAULLE	97
NHS BLOOD & TRANSPLANT	NHS BLOOD TRANSPLANT	100
DEPARTMENT OF ENERGY AND CLIMATE CHANGE	DEPARTMENT OF ENERGY AN CLIMATE CHANGE	99
ST GEORGE'S UNIVERSITY HOSPITALS NHS FOUNDATION TRUST	ST GEORGE'S UNIVERSITY HOSPITAL NHS FOUNDATION TRUST	99
KINGS COLLEGE HOSPITAL NHS FOUNDATION TRUST	KINGS COLLEGE HOSPITAL NHDS FOUNDATION TRUST	99
KINGS COLLEGE HOSPITAL NHS FOUNDATION TRUST	KING'S COLLEGE HOSPITAL NHS FOUNDATION TRUST	97
SURREY & BORDERS PARTNERSHIP NHS FOUNDATION TRUST	SURREY AND BORDERS PARTNERSHIP NHS FOUNDATION TRUST	96
NORTHAMPTONSNHIRE COUNTY COUNCIL	NORTHAMPTONSHIRE COUNTY COUNCIL	98
THE COLLEGE OF HARINGEY, ENFIELD & NORTH EAST LONDON	THE COLLEGE OF HARINGEY, ENFIELD AND NORTH EAST LONDON	96
YORKSHIRE HOUSING LTD	YORKSHIRE HOUSING LTD.	100
GUY'S & ST THOMAS' NHS FOUNDATION TRUST	GUY'S & ST. THOMAS' NHS FOUNDATION TRUST	100
THE POLICE AND CRIME COMMISSIONER FOR LINCOLNSHIRE	THE POLICE & CRIME COMMISSIONER FOR LINCOLNSHIRE	96
SURREY AND BORDERS PARTNERSHIP NHS FOUNDATION TRUST ON BEHALF OF NHS COMMERCIAL SOLUTION	SURREY AND BORDERS PARTNERSHIP NHS FOUNDATION TRUST ON BEHALF OF NHS COMMERCIAL SOLUTIONS	99
NHS HARTLEPOOL & STOCKTON-ON-TEES CLINICAL COMMISSIONING GROUP	NHS HARTLEPOOL AND STOCKTON ON TEES CLINICAL COMMISSIONING GROUP	97
NHS HARTLEPOOL & STOCKTON-ON-TEES CLINICAL COMMISSIONING GROUP	NHS HARTLEPOOL AND STOCKTON-ON-TEES CLINICAL COMMISSIONING GROUP	97
DRIVER AND VEHICLE LICENSING AGENCY	DRIVERS AND VEHICLE LICENSING AGENCY	99
DRIVER AND VEHICLE LICENSING AGENCY	DRIVER AND VEHILCE LICENSING AGENCY	97
AMBER VALLEY BOROUGH COUNCIL	AMBER VALLEY BOROUGH COUNCIL.	100
DEPARTMENT OF BUSINESS, ENERGY AND INDUSTRIAL STRATEGY (BEIS)	DEPARTMENT OF BUSINESS ENERGY AND INDUSTRIAL STRATEGY (BEIS)	100
UCLPARTNERS PROCUREMENT SERVICE	UCLPARTNERS PROCUREMENT SERVICES	98
DOUNREAY SITE RESTORATION LIMITED  	DOUNREAY SITE RESTORATION LIMITED	100
GREATER GLASGOW HEALTH BOARD (HEREAFTER REFERRED TO AS THE “AUTHORITY”).	GREATER GLASGOW HEALTH BOARD (HEREAFTER REFERRED TO AS THE ‘AUTHORITY’)	100
BERNICIA GROUP	BERNICIA GROUP,	100
MINISTRY OF DEFENCE, AIR SUPPORT, AIRCRAFT COMMODITIES PROJECT TEAM (AC PT)	MINISTRY OF DEFENCE, AIR SUPPORT, AIR COMMODITIES PROJECT TEAM (AC PT)	96
UK FISHERIES OFFSHORE OIL & GAS LEGACY TRUST FUND LIMITED	UK FISHERIES OFFSHORE OIL AND GAS LEGACY TRUST FUND LIMITED	96
REDDITCH BOROUGH & BROMSGROVE DISTRICT COUNCILS	REDDITCH BOROUGH AND BROMSGROVE DISTRICT COUNCILS	96
REDDITCH BOROUGH & BROMSGROVE DISTRICT COUNCILS	REDDITCH BOROUGH &AMP; BROMSGROVE DISTRICT COUNCILS	96
ANSA ENVIRONMENTAL SERVICES	ANSA ENVIRIONMENTAL SERVICES	98
NORTH EASTERN UNIVERSITIES PURCHASING CONSORTIA	NORTH EASTERN UNIVERSITIES PURCHASING CONSORTIUM	97
MINISTRY OF DEFENCE, ISTAR, AIR DEFENCE & ELECTRONIC WARFARE SYSTEMS	MINISTRY OF DEFENCE, ISTAR, AIR DEFENCE AND ELECTRONIC WARFARE SYSTEMS	97
SOUTH, CENTRAL AND WEST COMMISSIONING SUPPORT UNIT	SOUTH CENTRAL AND WEST COMMISSIONING SUPPORT UNIT	100
SOUTH, CENTRAL AND WEST COMMISSIONING SUPPORT UNIT	SOUTH CENTRAL & WEST COMMISSIONING SUPPORT UNIT	96
CPD — CONSTRUCTION HEALTH PROJECTS	CPD - CONSTRUCTION HEALTH PROJECTS	100
MRDE LIMITED AND BEDFORD STREET DEVELOPMENT LIMITED BSDL	MRDE LIMITED AND BEDFORD STREET DEVELOPMENTS LIMITED (BSDL)	99
LONDON BOROUGH OF BARNET 	LONDON BOROUGH OF BARNET	100
COMMERCIAL — OPERATIONS LONDON UNDERGROUND	COMMERCIAL – OPERATIONS LONDON UNDERGROUND	100
THE MIDLAND ACADMIES TRUST (NORTH WARWICKSHIRE AND HINCKLEY COLLEGE)	THE MIDLAND ACADMIES TRUST (NORTH WARWICKSHIRE & HINCKLEY COLLEGE)	97
CITY HOSPITALS SUNDERLAND FOUNDATION TRUST	CITY HOSPITAL SUNDERLAND FOUNDATION TRUST	99
STOCKPORT METROPOLITAN BOROUGH COUNCIL	STOCKPORT METROPOLITON BOROUGH COUNCIL 	97
DONCASTER & BASSETLAW HOSPITALS NHS FOUNDATION TRUST	DONCASTER AND BASSETLAW HOSPITALS NHS FOUNDATION TRUST	96
EAST MIDLANDS STRATEGIC COMMERCIAL UNIT (EMSCU	EAST MIDLANDS STRATEGIC COMMERCIAL UNIT (EMSCU)	100
CUMBRIA CONSTABULARY - OFFICE OF THE POLICE & CRIME COMMISSIONER	CUMBRIA CONSTABULARY — OFFICE OF THE POLICE & CRIME COMMISSIONER	100
NHS ENGLAND, CUMBRIA AND THE NORTH EAST	NHS ENGLAND: CUMBRIA AND THE NORTH EAST	100
NHS ENGLAND, CUMBRIA AND THE NORTH EAST	NHS ENGLAND (CUMBRIA AND THE NORTH EAST)	100
NHS ENGLAND, CUMBRIA AND THE NORTH EAST	NHS ENGLAND CUMBRIA AND THE NORTH EAST	100
NHS ENGLAND, CUMBRIA AND THE NORTH EAST	NHS ENGLAND (CUBRIA AND THE NORTH EAST)	99
THE QUEEN ELIZABETH HOSPITAL KINGS LYNN NHS FOUNDATION TRUST	THE QUEEN ELIZABETH HOSPITAL KING'S LYNN NHS FOUNDATION TRUST	98
A2DOMINION HOUSING GROUP LIMITED	A2 DOMINION HOUSING GROUP LIMITED	98
MINISTRY OF JUSTICE	MINISTRY OF JUSTICE.	100
KENT SURREY SUSSE AHSN LTD	KENT SURREY SUSSEX AHSN LTD	98
CHESTERFIELD ROYAL HOSPITALS NHS FOUNDATION TRUST	CHESTERFIELD ROYAL HOSPITAL NHS FOUNDATION TRUST	99
TRANSPORT SERVICE SOUTIONS TRADING AS CHESHIRE EAST BOROUGH COUNCIL	TRANSPORT SERVICE SOLUTIONS TRADIG AS CHESHIRE EAST BOROUGH COUNCIL	99
TRANSPORT SERVICE SOUTIONS TRADING AS CHESHIRE EAST BOROUGH COUNCIL	TRANSPORT SERVICE SOLUTIONS TRADING AS CHESHIRE EAST BOROUGH COUNCIL	99
TRANSPORT SERVICE SOUTIONS TRADING AS CHESHIRE EAST BOROUGH COUNCIL	TRANSPORT SERVICE SOLUTIONS TRADING AS CHESHIRE EAST BOROUGH COUNCIL 	99
MINISTRY OF DEFENCE, INFORMATION SYSTEMS & SERVICES	MINISTRY OF DEFENCE (INFORMATION SYSTEM SERVICES)	99
NOE CPC	NOE-CPC	100
EPSOM & ST HELIER UNIVERSITY HOSPITAL NHS TRUST	EPSOM & ST HELIER UNIVERSITY HOSPITALS NHS TRUST	99
SUFFOLK COASTAL DISTRICT COUNCIL	SUFFOLK COASTAL DISCTRICT COUNCIL	98
THE TRUSTEES OF THE NATIONAL MARITIME MUSEUM	THE TRUSTEES OF  THE NATIONAL MARITIME MUSEUM	100
ANY OF THE PROJECTS LISTED ON THE PORTAL	ANY OF THE PROJECTS LISTED ON THE PORTAL 	100
DEPARTMENT FOR BUSINESS, ENERGY & INDUSTRIAL STRATEGY (BEIS)	DEPARTMENT FOR BUSINESS ENERGY AND INDUSTRIAL STRATEGY (BEIS)	96
DEPARTMENT FOR BUSINESS, ENERGY & INDUSTRIAL STRATEGY (BEIS)	DEPARTMENT FOR BUSINESS, ENERGY AND INDUSTRIAL STRATEGY (BEIS)	96
DEPARTMENT FOR CULTURE, MEDIA AND SPORT	DEPARTMENT FOR CULTURE MEDIA AND SPORT	100
N HS BEXLEY CLINICAL COMMISSIONING GROUP	NHS BEXLEY CLINICAL COMMISSIONING GROUP	96
BEXLEY CLINICAL COMMISSIONING GROUP	BEXLEY CLINCAL COMMISSIONING GROUP	99
HM COURTS AND TRIBUNALS SERVICE (HMCTS)	HM COURTS AND TRIBUNAL SERVICE (HMCTS)	99
NHS ENGLAND, CHESHIRE AND MERSEYSIDE 	NHS ENGLAND - CHESHIRE AND MERSEYSIDE	100
NHS ENGLAND, CHESHIRE AND MERSEYSIDE 	NHS ENGLAND (CHESHIRE AND MERSEYSIDE)	100
NHS NEWCASTLE GATESHEAD AND NHS SOUTH TYNESIDE CCG	NHS NEWCASTLE GATESHEAD CCG  AND NHS SOUTH TYNESIDE CCG	96
DEPARTMENT OF ENERGY & CLIMATE CHANGE	DEPARTMENT OF ENERGY AN CLIMATE CHANGE	96
GRIMSBY INSTITUTE OF FURTHER &AMP; HIGHER EDUCATION	GRIMSBY INSTITUTE OF FURTHER & HIGHER EDUCATION	96
QUEEN  VICTORIA FOUNDATION NHS TRUST	QUEEN VICTORIA NHS FOUNDATION TRUST	100
QUEEN  VICTORIA FOUNDATION NHS TRUST	QUEEN VICTORIA  NHS FOUNDATION TRUST	100
ARDEN &  GREATER EAST MIDLANDS COMMISSIONING SUPPORT UNIT	ARDEN & GREATER EAST MIDLANDS  COMMISSIONING SUPPORT UNIT	100
ARDEN &  GREATER EAST MIDLANDS COMMISSIONING SUPPORT UNIT	ARDEN & GREATER EAST MIDLANDS COMMISSIONING SUPPORT UNIT	100
ARDEN &  GREATER EAST MIDLANDS COMMISSIONING SUPPORT UNIT	ARDEN AND GREATER EAST MIDLANDS COMMISSIONING SUPPORT UNIT	96
DEPARTMENT FOR BUSINESS, ENERGY AND INDUSTRIAL STRATEGY	DEPARTMENT FOR BUSINESS ENERGY AND INDUSTRIAL STRATEGY	100
DEPARTMENT FOR BUSINESS, ENERGY AND INDUSTRIAL STRATEGY	DEPARTMENT FOR BUSINESS, ENERGY & INDUSTRIAL STRATEGY	96
DEPARTMENT FOR BUSINESS, ENERGY AND INDUSTRIAL STRATEGY	DEPARTMENT FOR BUSINESS ENERGY AND INDUSTRIAL STRATEGY (BEIS)	96
DEPARTMENT FOR BUSINESS, ENERGY AND INDUSTRIAL STRATEGY	DEPARTMENT FOR BUSINESS, ENERGY AND INDUSTRIAL STRATEGY (BEIS)	96
ST HELENS AND KNOWSLEY TEACHING HOSPITALS NHS TRUST	ST HELENS & KNOWSLEY TEACHING HOSPITALS NHS TRUST	96
ST HELENS AND KNOWSLEY TEACHING HOSPITALS NHS TRUST	ST HELENS &AMP; KNOWSLEY TEACHING HOSPITALS NHS TRUST	96
HIGHTOWN HOUSING ASSOCIATION LTD	HIGHTOWN  HOUSING ASSOCIATION LTD	100
MARITIME COASTGUARD AGENCY	MARITIME & COASTGUARD AGENCY	100
FINANCIAL SERVICE COMPENSATION SCHEME LIMITED	FINANCIAL SERVICES COMPENSATION SCHEME LIMITED	99
TRANSPORT FOR LONDON (COMMERCIAL SERVICES )	TRANSPORT FOR LONDON (COMMERCIAL SERVICES)	100
HM REVENUE & CUSTOMS	H M REVENUE & CUSTOMS	97
THE POLICE & CRIME COMMISSIONER FOR HUMBERSIDE	THE POLICE AND CRIME COMMISSIONER FOR HUMBERSIDE	96
UNVERSITY COLLEGE LONDON	UNIVERSITY COLLEGE LONDON	98
ROYAL BOROUGH OF KENSINGTON AND CHELSEA	ROYAL BOROUGH KENSINGTON AND CHELSEA	96
AGRI-FOOD AND BIOSCIENCES INSTITUTE NI	AGRI-FOOD AND BIOSCIENCES INSTITUTE	96
DEFENCE INFRASTRUCTURE ORGANIATION	DEFENCE INFRASTRUCTURE ORGANISATION	99
MERSEYSIDE POLICE — PROCUREMENT DEPARTMENT	MERSEYSIDE POLICE - PROCUREMENT DEPARTMENT	100
NHS NORTH TYNESIDE CLINICAL COMMISSIONING GROUP	NHS, SOUTH TYNESIDE CLINICAL COMMISSIONING GROUP 	96
NHS NORTH TYNESIDE CLINICAL COMMISSIONING GROUP	NHS SOUTH TYNESIDE CLINICAL COMMISSIONING GROUP	96
NHS NEWCASTLE GATESHEAD CLINICAL COMMISSIONING GROUP	NHS NEWCASTLE GATESHEAD CLINICAL COMMISSIONING GROUP  	100
CIVIL NUCLEAR POLICE AUTHORITY (CNPA) / CIVIL NUCLEAR CONSTABULARY (CNC)	CIVIL NUCLEAR POLICE AUTHORITY (CNPA)  / CIVIL NUCLEAR CONSTABULARY (CNC)	100
SOUTH DERBYSHIRE DISTRICT COUNCIL	SOUTH DERBYSHIRE DISTRICT COUNCIL.	100
LIVERPOOL HEART AND CHEST HOSPITAL NHS FOUNDATION TRUST	LIVERPOOL HEART AND CHEST HOSPITAL, NHS FOUNDATION TRUST	100
THE HORNIMAN PUBLIC MUSEUM AND PUBLIC PARK TRUST	THE HORNIMAN PUBLIC MUSEUM & PUBLIC PARK TRUST	96
QUEEN' UNIVERSITY BELFAST	QUEENS UNIVERSITY BELFAST	98
QUEEN' UNIVERSITY BELFAST	QUEEN'S UNIVERSITY BELFAST	96
SHEFFIELD TEACHING HOSPITAL	SHEFFIELD TEACHING HOSPITALS	98
LEEDS & YORK PARTNERSHIP NHS FOUNDATION TRUST	LEEDS AND YORK PARTNERSHIP NHS FOUNDATION TRUST	96
BELFAST HEALTH AND SCOICAL CARE TRUST	BELFAST HEALTH AND SOCIAL CARE TRUST	96
IRWELL VALLEY HOUSING ASSOCIATION 	IRWELL VALLEY HOUSING ASSOCIATION	100
COVENTRY AND WARWICKSHIRE PARTNERSHIP TRUST	COVENTRY AND WARWICKSHIRE PARTNERSHIP NHS TRUST	96
ROYAL BOURNEMOUTH & CHRISTCHURCH HOSPITALS NHS FOUNDATION TRUST	ROYAL BOURNEMOUTH AND CHRISTCHURCH HOSPITALS NHS FOUNDATION TRUST	97
ARMAGH CITY, BANBRIDGE AND CRAIGAVON BOROUGH COUNCIL	ARMAGH CITY BANBRIDGE AND CRAIGAVON BOROUGH COUNCIL	100
CHESHIRE & WARRINGTON LOCAL ENTERPRISE PARTNERSHIP	CHESHIRE AND WARRINGTON LOCAL ENTERPRISE PARTNERSHIP	96
NORFOLK COMMUNITY HEALTH AND CARE (NHS TRUST)	NORFOLK COMMUNITY HEALTH AND CARE NHS TRUST	100
COLSTON'S GIRLS' SCHOOL TRUST AND THE OLYMPUS ACADEMY TRUST	COLSTON'S GIRLS' SCHOOL TRUST & THE OLYMPUS ACADEMY TRUST	96
LEWES DISTRICT COUNCIL	LEWES DISTRICT  COUNCIL	100
BUSIENSS SERVICES ORGANISATION PROCUREMENT AND LOGISTICS SERVICE	BUSINESS SERVICES ORGANISATION, PROCUREMENT AND LOGISTICS SERVICE	98
MINISTRY OF DEFENCE, DSTL	MINISTRY OF DEFENCE, DSTL.	100
COVENTRY & WARWICKSHIRE PARTNERSHIP NHS TRUST	COVENTRY AND WARWICKSHIRE PARTNERSHIP NHS TRUST	96
THISTLE HOUSING ASSOCIATION LTD.	THISTLE HOUSING ASSOCIATION LTD	100
NORTH TEES AND HARTLEPOOL NHS FOUNDATION TRUST	NORTH TEES &AMP; HARTLEPOOL NHS FOUNDATION TRUST	96
WARRINGTON AND HALTON HOSPITALS NHS FOUNDATION TRUST	WARRINGTON &AMP; HALTON HOSPITALS NHS FOUNDATION TRUST	96
WARRINGTON AND HALTON HOSPITALS NHS FOUNDATION TRUST	WARRINGTON & HALTON HOSPITALS NHS FOUNDATION TRUST	96
NORTH WESTERN UNIVERSITIES PURCHASING CONSORTIUM LTD	NORTH WESTERN UNIVERSITIES PURCHASING CONSORTIUM LIMITED	96
FORESTRY COMMISSON	FORESTRY COMMISSION `	97
FORESTRY COMMISSON	FORESTRY COMMISSION	97
NHS SOMERSET CLINICAL COMISSIONING GROUP	NHS SOMERSET CLINICAL COMMISSIONING GROUP	99
MINISTRY OF DEFENCE, DSG	MINISTRY OF DEFENCE, DSG,	100
TRANSPORT FOR LONDON — SURFACE COMMERCIAL	TRANSPORT FOR LONDON — COMMERCIAL SURFACE	100
TRANSPORT FOR LONDON — SURFACE COMMERCIAL	TRANSPORT FOR LONDON -  COMMERCIAL SURFACE	100
WELWYN HAFTIELD BOROUGH COUNCIL	WELWYN HATFIELD BOROUGH COUNCIL	97
UNKNOWN	UNKNOWN...	100
BASILDON AND THURROCK UNIVERSITY HOSPITALS NHS FOUNDATION TRUST	BASILDON AND THURROCK UNIVERSITY HOSPITALS, NHS FOUNDATION TRUST	100
NHS ENGLAND, LANCASHIRE AND GREATER MANCHESTER	NHS ENGLAND LANCASHIRE AND GREATER MANCHESTER	100
NHS ENGLAND, LANCASHIRE AND GREATER MANCHESTER	NHS ENGLAND: LANCASHIRE AND GREATER MANCHESTER	100
SANDWELL & WEST BIRMINGHAM HOSPITALS N H S TRUST	SANDWELL WEST BIRMINGHAM HOSPITALS NHS TRUST	96
CPD - SUPPLIES AND SERVICES DIVISION	CPD — SUPPLIES AND SERVICES DIVISION	100
NORTH OF ENGLAND COMMISSIONING SUPPORT (ON BEHALF OF NEWCASTLE GATESHEAD CCG AND SOUTH TYNESIDE CCG)	NORTH OF ENGLAND COMMISSIONING SUPPORT FOR AND ON BEHALF OF NEWCASTLE GATESHEAD / SOUTH TYNESIDE CCG	96
POLICE AND CRIME COMMISSIONER FOR DYFED POWYS	POLICE AND CRIME COMMISSIONER FOR DYFED-POWYS	100
CAPITA BUSINESS SERVICES	CAPITA BUSINESS SERVICES 	100
CAPITA BUSINESS SERVICES	CAPITA BUSINESS SERVICE	98
CAPITA BUSINESS SERVICES	CAPITA BSUINESS SERVICES	96
DRIVER & VEHICLE LICENSING AGENCY	DRIVER VEHICLE LICENSING AGENCY	100
WIRRAL UNIVERSITY TEACHING HOSPITAL NHS FOUNDATION TRUST	WIRRAL UNIVERSITY TEACHING HOSPITAL  NHS FOUNDATION TRUST	100
DARLINGTON CLINICAL COMMISSIONING GROUP 	DARLINGTON CLINICAL COMMISSIONING GROUP	100
DONCASTER CHILDREN?S SERVICES TRUST	DONCASTER CHILDREN’S SERVICES TRUST	100
NATIONAL RECORDS OF SCOTLAND	NATONAL RECORDS OF SCOTLAND	98
LEEDS CITY COUNCIL, PROJECTS, PROGRAMMES AND PROCUREMENT UNIT	LEEDS CITY COUNCIL, PROJECTS PROGRAMMES AND PROCUREMENT UNIT (PPPU)	96
VELINDRE NHS TRUST, NHS WALES SHARED SERVICES PARTNERSHIP — PROCUREMENT SERVICES (ON BEHALF OF ALL WALES LHB'S AND TRUSTS)	VELINDRE NHS TRUST — NHS WALES SHARED SERVICES PARTNERSHIP — PROCUREMENT SERVICES (ON BEHALF OF ALL WALES LHB'S AND TRUSTS)	100
COMPETITION AND MARKETS AUTHORITY	COMPETITION AND MARKET AUTHORITY	98
SOUTH TEES HOSPITALS NHS FOUNDATION TRUST	SOUTH TEES HOSPITAL NHS FOUNDATION TRUST	99
NHS ENGLAND, YORKSHIRE AND THE HUMBER	NHS ENGLAND, YORKSHIRE AND THE HUMBER 	100
CARDIFF AND VALE NHS TRUST	CARDIFF AND VALE NHS TRUST.	100
DORSET HEATHCARE UNIVERSITY NHS FOUNDATION TRUST	DORSET HEALTHCARE UNIVERSITY NHS FOUNDATION TRUST	99
DEPARTMENT FOR ENVIRONMENT, FOOD & RURAL AFFAIRS	DEPARTMENT FOR ENVIRONMENT, FOOD AND RURAL AFFAIRS	96
MINISTRY OF DEFENCE, DSG, DEFENCE ELECTRONICS AND COMPONENTS AGENCY (DECA)	MINISTRY OF DEFENCE, DEFENCE ELECTRONICS AND COMPONENTS AGENCY (DECA)	97
WYCOMBE DISTICT COUNCIL	WYCOMBE DISTRICT COUNCIL	98
UNIVERSITY COLLEGE OF LONDON HOSPITALS NHS FOUNDATION TRUST	UNIVERSITY COLLEGE LONDON HOSPITALS NHS FOUNDATION TRUST	97
RE: ALLIES WORKS LIMITED	RE:ALLIES WORKS LIMITED	100
SABHAL MOR OSTAIG	SABHAL MÒR OSTAIG	97
POLICE SERVICE OF NORTHERN IRELAND PSNI	POLICE SERVICE OF NORTHERN IRELAND (PSNI)	100
POLICE SERVICE OF NORTHERN IRELAND PSNI	PSNI - POLICE SERVICE OF NORTHERN IRELAND	100
NHS ENGLAND, NORTH EAST AND CUMBRIA	NHS ENGLAND CUMBRIA AND NORTH EAST	100
SOUTHEND UNIVERSITY HOSPITAL NHS FOUNDATION TRUST	SOUTHEND UNIVERITY HOSPITAL NHS FOUNDATION TRUST	99
CAMBRIDGESHIRE DISTRICT COUNCILS - SOUTH CAMBRIDGESHIRE DISTRICT COUNCIL	CAMBRIDGESHIRE DISTRICT COUNCILS — SOUTH CAMBRIDGESHIRE DISTRICT COUNCIL	100
CAMBRIDGESHIRE COUNTY COUNCIL 	CAMBRIDGESHIRE COUNTY COUNCIL	100
CAMBRIDGESHIRE COUNTY COUNCIL 	CMABRIDGESHIRE COUNTY COUNCIL	97
NORTHUMBERLAND TYNE & WEAR NHS FOUNDATION TRUST C/O THE INENCO GROUP	NORTHUMBERLAND TYNE AND WEAR NHS FOUNDATION TRUST C/O THE INENCO GROUP	97
TRANSPORT FOR LONDON — LONDON UNDERGROUND (COMMERCIAL OPERATIONS)	TRANSPORT FOR LONDON - LONDON UNDERGROUND (COMMERCIAL OPERATIONS)	100
NHS WANDSWORTH CLINICAL COMMISIONING GROUP	NHS WANDSWORTH CLINICAL COMMISSIONING GROUP	99
NHS – WALTHAM FOREST CLINICAL COMMISSIONING GROUP	NHS WALTHAM FOREST CLINICAL COMMISSIONING GROUP	100
